{
  "code": "COMPSCI 4417B",
  "name": "UNSTRUCTURED DATA",
  "term": "Winter",
  "components": [
    {
      "type": "LEC",
      "sections": [
        {
          "section": "001",
          "classNbr": "11358",
          "instructor": "M. Elsayed",
          "campus": "Main",
          "deliveryType": "In Person",
          "status": "Not Full",
          "waitlist": 0,
          "meetings": [
            {
              "day": "Tu",
              "start": "15:30",
              "end": "16:30",
              "location": "NCB-113"
            },
            {
              "day": "Th",
              "start": "14:30",
              "end": "16:30",
              "location": "NCB-113"
            }
          ]
        }
      ]
    }
  ]
}