{
  "code": "COMPSCI 4452B",
  "name": "DEEP LEARNING COMPUTER VISION",
  "term": "Winter",
  "components": [
    {
      "type": "LEC",
      "sections": [
        {
          "section": "001",
          "classNbr": "14246",
          "instructor": "B. Davis",
          "campus": "Main",
          "deliveryType": "In Person",
          "status": "Not Full",
          "waitlist": 0,
          "meetings": [
            {
              "day": "Mo",
              "start": "09:30",
              "end": "11:30",
              "location": "SEB-2200"
            },
            {
              "day": "We",
              "start": "09:30",
              "end": "10:30",
              "location": "SEB-2200"
            }
          ]
        }
      ]
    }
  ]
}