{
  "code": "AISE 4020B",
  "name": "AI SYS ENGINEERING DESIGN I",
  "term": "Winter",
  "components": [
    {
      "type": "LEC",
      "sections": [
        {
          "section": "001",
          "classNbr": "13536",
          "instructor": "L. Brown",
          "campus": "Main",
          "deliveryType": "In Person",
          "status": "Not Full",
          "waitlist": 0,
          "meetings": [
            {
              "day": "Th",
              "start": "16:30",
              "end": "17:30",
              "location": "ACEB-1420"
            }
          ]
        },
        {
          "section": "002",
          "classNbr": "13537",
          "instructor": "S. Ali",
          "campus": "Main",
          "deliveryType": "In Person",
          "status": "Not Full",
          "waitlist": 0,
          "meetings": [
            {
              "day": "Tu",
              "start": "13:30",
              "end": "14:30",
              "location": "ACEB-1415"
            }
          ]
        }
      ]
    },
    {
      "type": "LAB",
      "sections": [
        {
          "section": "003",
          "classNbr": "13538",
          "instructor": "L. Brown",
          "campus": "Main",
          "deliveryType": "In Person",
          "status": "Not Full",
          "waitlist": 0,
          "meetings": [
            {
              "day": "Th",
              "start": "09:30",
              "end": "12:30",
              "location": "ACEB-2400"
            }
          ]
        },
        {
          "section": "004",
          "classNbr": "13541",
          "instructor": "L. Brown",
          "campus": "Main",
          "deliveryType": "In Person",
          "status": "Not Full",
          "waitlist": 0,
          "meetings": [
            {
              "day": "We",
              "start": "14:30",
              "end": "17:30",
              "location": "ACEB-2400"
            }
          ]
        },
        {
          "section": "005",
          "classNbr": "13542",
          "instructor": "S. Ali",
          "campus": "Main",
          "deliveryType": "In Person",
          "status": "Not Full",
          "waitlist": 0,
          "meetings": [
            {
              "day": "Mo",
              "start": "18:30",
              "end": "21:30",
              "location": "ACEB-2400"
            }
          ]
        },
        {
          "section": "006",
          "classNbr": "14015",
          "instructor": "S. Ali",
          "campus": "Main",
          "deliveryType": "In Person",
          "status": "Not Full",
          "waitlist": 0,
          "meetings": [
            {
              "day": "Fr",
              "start": "11:30",
              "end": "14:30",
              "location": "ACEB-2400"
            }
          ]
        },
        {
          "section": "007",
          "classNbr": "18348",
          "instructor": "S. Ali",
          "campus": "Main",
          "deliveryType": "In Person",
          "status": "Not Full",
          "waitlist": 0,
          "meetings": [
            {
              "day": "Tu",
              "start": "18:30",
              "end": "21:30",
              "location": "ACEB-2400"
            }
          ]
        }
      ]
    }
  ]
}